,Indicator Name,SDG,Indicator Code,Indicator Short Name
387,"Unemployment, youth female (% of female labor force ages 15-24) (national estimate)",8,SL.UEM.1524.FE.NE.ZS,"Unemployment, youth female"
388,"Unemployment, youth male (% of male labor force ages 15-24) (modeled ILO estimate)",8,SL.UEM.1524.MA.ZS,"Unemployment, youth male (ILO)"
389,"Unemployment, youth male (% of male labor force ages 15-24) (national estimate)",8,SL.UEM.1524.MA.NE.ZS,"Unemployment, youth male"
390,"Unemployment, youth total (% of total labor force ages 15-24) (modeled ILO estimate)",8,SL.UEM.1524.ZS,"Unemployment, youth total (ILO)"
391,"Unemployment, youth total (% of total labor force ages 15-24) (national estimate)",8,SL.UEM.1524.NE.ZS,"Unemployment, youth total"
392,Urban population,1,SP.URB.TOTL,Urban population
393,Urban population (% of total population),1,SP.URB.TOTL.IN.ZS,Urban population
394,Urban population growth (annual %),1,SP.URB.GROW,Urban population growth
395,Urban poverty headcount ratio at national poverty lines (% of urban population),1,SI.POV.URHC,Urban poverty headcount ratio at national poverty lines
396,"Wage and salaried workers, female (% of female employment) (modeled ILO estimate)",8,SL.EMP.WORK.FE.ZS,"Wage and salaried workers, female"
397,"Wage and salaried workers, male (% of male employment) (modeled ILO estimate)",8,SL.EMP.WORK.MA.ZS,"Wage and salaried workers, male"
398,"Wage and salaried workers, total (% of total employment) (modeled ILO estimate)",8,SL.EMP.WORK.ZS,"Wage and salaried workers, total"
399,"Water productivity, total (constant 2010 US$ GDP per cubic meter of total freshwater withdrawal)",6,ER.GDP.FWTL.M3.KD,"Water productivity, total"
400,Women Business and the Law Index Score (scale 1-100),5,SG.LAW.INDX,Women Business and the Law Index Score
401,"Women making their own informed decisions regarding sexual relations, contraceptive use and reproductive health care  (% of women age 15-49)",5,SG.DMK.SRCR.FN.ZS,"Women own decisions on sexual relations, contraceptive use and reproductive health"
402,Women who were first married by age 15 (% of women ages 20-24),5,SP.M15.2024.FE.ZS,Women who were first married by age 15
403,Women who were first married by age 18 (% of women ages 20-24),5,SP.M18.2024.FE.ZS,Women who were first married by age 18